{
  "contract_version": "1.0.0",
  "run_id": "11111111-1111-4111-8111-111111111111",
  "story_id": "STORY-001",
  "story_hash": "sha256:cccccccccccccccccccccccccccccccccccccccccccccccccccccccccccccccc",
  "revision": 1,
  "delivery_manifest_hash": "sha256:eeeeeeeeeeeeeeeeeeeeeeeeeeeeeeeeeeeeeeeeeeeeeeeeeeeeeeeeeeeeeeee",
  "criteria": [
    {
      "criterion_id": "AC-001",
      "order": 1,
      "description": "A reserva válida é persistida."
    }
  ],
  "cases": [
    {
      "case_id": "CASE-001",
      "criterion_id": "AC-001",
      "gate": "G3",
      "title": "Persistir uma reserva válida",
      "test_type": "integration",
      "execution": {
        "argv": ["pytest", "tests/test_reservations.py", "-q"],
        "cwd": "/tests",
        "timeout_seconds": 120,
        "profile": "python"
      },
      "expected": "A consulta retorna os dados persistidos.",
      "evidence_types": ["junit", "stdout"],
      "required": true
    }
  ],
  "test_artifacts": [],
  "environment": {
    "rebuild_on_manifest_change": true,
    "manifest_paths": ["pyproject.toml"],
    "runner_profile": "python"
  }
}
